{
  "$schema": "https://json-schema.org/draft/2020-12/schema",
  "title": "跨语种戏剧演出版本台领域事件",
  "type": "object",
  "required": [
    "event_id",
    "event_type",
    "aggregate_type",
    "aggregate_id",
    "occurred_at",
    "version",
    "payload"
  ],
  "properties": {
    "event_id": {
      "type": "string",
      "minLength": 1
    },
    "event_type": {
      "type": "string",
      "enum": [
        "SCRIPT_REGISTERED",
        "STAGE_ADVANCED",
        "SEGMENT_ADDED",
        "FACT_CONFIRMED",
        "CONSENT_RECORDED",
        "CONSENT_WITHDRAWN",
        "TRANSLATION_SUBMITTED",
        "NOTE_ADDED",
        "VERSION_SUBMITTED",
        "VERSION_SIGNED",
        "VERSION_APPROVED",
        "REHEARSAL_CONFIRMED",
        "RUN_SCHEDULED",
        "LANGUAGE_REQUESTED",
        "RUN_LOCKED",
        "RUN_REVISED",
        "LIVE_CHANGE_RECORDED",
        "RECEIPT_RECORDED",
        "DISPUTE_RAISED",
        "ERRATA_ISSUED"
      ]
    },
    "aggregate_type": {
      "type": "string",
      "enum": [
        "play_script",
        "source_segment",
        "consent_record",
        "translation_candidate",
        "cultural_note",
        "release_version",
        "performance_run",
        "live_change",
        "dispute_case"
      ]
    },
    "aggregate_id": {
      "type": "string",
      "minLength": 1
    },
    "occurred_at": {
      "type": "string",
      "format": "date-time"
    },
    "version": {
      "type": "integer",
      "minimum": 1
    },
    "payload": {
      "type": "object"
    }
  },
  "payload_required_by_event": {
    "STAGE_ADVANCED": [
      "to_stage"
    ],
    "SEGMENT_ADDED": [
      "script_ref",
      "order",
      "text",
      "kind"
    ],
    "FACT_CONFIRMED": [
      "segment_ref",
      "witness"
    ],
    "CONSENT_RECORDED": [
      "subject_ref",
      "scope",
      "withdraw_by"
    ],
    "CONSENT_WITHDRAWN": [
      "reason"
    ],
    "TRANSLATION_SUBMITTED": [
      "segment_ref",
      "language",
      "text",
      "translator",
      "fingerprint"
    ],
    "NOTE_ADDED": [
      "segment_ref",
      "language",
      "text"
    ],
    "VERSION_SUBMITTED": [
      "script_ref",
      "number",
      "items",
      "submitted_by"
    ],
    "VERSION_SIGNED": [
      "role",
      "signer"
    ],
    "VERSION_APPROVED": [
      "number"
    ],
    "REHEARSAL_CONFIRMED": [
      "confirmer"
    ],
    "RUN_SCHEDULED": [
      "script_ref",
      "starts_at",
      "submission_cutoff"
    ],
    "LANGUAGE_REQUESTED": [
      "language"
    ],
    "RUN_LOCKED": [
      "script_version",
      "starts_at",
      "version_ref",
      "fingerprint"
    ],
    "RUN_REVISED": [
      "version_ref",
      "script_version",
      "fingerprint"
    ],
    "LIVE_CHANGE_RECORDED": [
      "run_ref",
      "segment_ref",
      "language",
      "text",
      "reason",
      "fingerprint"
    ],
    "RECEIPT_RECORDED": [
      "receipt_id",
      "version_number",
      "fingerprint",
      "outcome"
    ],
    "DISPUTE_RAISED": [
      "run_ref",
      "receipt_id",
      "expected_fingerprint",
      "actual_fingerprint"
    ],
    "ERRATA_ISSUED": [
      "supersedes",
      "reason",
      "run_ref",
      "errata_id"
    ]
  },
  "additionalProperties": false
}
